{
  "claims": [
    {
      "evidence": null,
      "function": "sha256:1f59cefdc8abf498ece2333a36f0ba8d252bcc10d2b2b9421cad04ccda333e48",
      "id": "sha256:e9d15da6f77c08af5badef66030f0ac7bf31da2e04a65f613eb96ee2f56a8ff2",
      "trust": "derived",
      "value": "pure"
    },
    {
      "evidence": null,
      "function": "sha256:5d0c798a06be2b561e78ce27dad5edaff14e4deca9cec0c16b176414763368f3",
      "id": "sha256:0b1a67d5f7c4485d793470924148858db79c5d739ebbed688819ef1bc4f6512d",
      "trust": "derived",
      "value": "pure"
    },
    {
      "evidence": {
        "callees": [
          "sha256:94a6becea29052f4dcb9e3234dc5679d9fa9657fa6dd5723e7311b03837b79bf"
        ],
        "frame": {
          "column": 4,
          "file": "fixtures/fact_trust/source.cpp",
          "line": 7
        },
        "method": "empty-frame-full-vc/v1",
        "obligations": [
          "ob00002"
        ],
        "referee": "codeskeptic.affine/v1",
        "source_sha256": "sha256:69a39935fc0e9e3b872084e9f9810643303386c64397d996bc397ec4738df628",
        "verification_schema": "codeskeptic.semantic-verification/v7",
        "verification_sha256": "sha256:a582fd926f1f711ff37f7269a33a60266f6155a5d2410e2744dcdbf29f42260d"
      },
      "function": "sha256:8f90a0778d2c355f624d718e8acc578c3c038f4aaff69a21deb9f2d4cbfa14b0",
      "id": "sha256:77c3488ad9c55b06da92a879a401a1ca808b40c897e6ead6ffd01df348f74f1b",
      "trust": "proved",
      "value": "pure"
    },
    {
      "evidence": {
        "callees": [],
        "frame": {
          "column": 4,
          "file": "fixtures/fact_trust/source.cpp",
          "line": 1
        },
        "method": "empty-frame-full-vc/v1",
        "obligations": [
          "ob00001"
        ],
        "referee": "codeskeptic.affine/v1",
        "source_sha256": "sha256:69a39935fc0e9e3b872084e9f9810643303386c64397d996bc397ec4738df628",
        "verification_schema": "codeskeptic.semantic-verification/v7",
        "verification_sha256": "sha256:a582fd926f1f711ff37f7269a33a60266f6155a5d2410e2744dcdbf29f42260d"
      },
      "function": "sha256:94a6becea29052f4dcb9e3234dc5679d9fa9657fa6dd5723e7311b03837b79bf",
      "id": "sha256:a95f1cbb930d914805e23258b36d3bf34dee09c9c7b02e5912e699f4d09a7daa",
      "trust": "proved",
      "value": "pure"
    }
  ],
  "fact_index": "sha256:1ad3da9c3c086480d48456ca061552a7c88758bbb7977123300597f6b5664004",
  "id": "sha256:c41a8d57d673aa76363e7a5a07d5c7b7548d709fd92ea6a4f47b12c46f2c8d4a",
  "schema": "codeskeptic.fact-trust/v1",
  "source_sha256": "sha256:69a39935fc0e9e3b872084e9f9810643303386c64397d996bc397ec4738df628"
}
